review,rating,summary
"Quite underwhelmed. My mam and dad wanted to go during their visit to China because they had never been to Disney land. Me and my wife were reluctant as our baby is 1.4 yrs old, and wondered who it would really be for, cause it ainâ€™t for us. They insisted it would be fun and even the baby would love it.I was reluctant but I thought, well itâ€™s supposed to be world class isnâ€™t it. Even if the queues for the rides are preposterously long, they must have sufficient entertainment for even the adults I guess. Wrong. Aside from the morning parade which was legit cool, the rest was just rides and visual things to look at, or super expressive consumerist experiences in the shops. The rides are not even that special or enticing to me, Iâ€™ve been in a few theme parks and even the just ok rides would have you waiting an hour to an hour and a half. Thatâ€™s about a third or a quarter of the time youâ€™d spend out and about, after you omit your meals. Just bad value.I really thought thereâ€™d be magical entertainment all over, like how in the fringe fest in Edinburgh, when you walk around thereâ€™s street acts and an electric vibe. Nothing really here though except walking around at the impressive areas they created. Although those areas are visually impressive, the main thing to do it seems is go to the rides. But the wait makes it impractical and miserable. Unless you wanna go on the equivalent to the teacupsâ€¦ then good for you only 20m wait.People spend a lot of time waiting to queue just for a photo with a character. We waited half an hour just to get the baby in a photo with Mickey Mouse and I just thought this is all just a big charade isnâ€™t it. I mean why not just have a few Mickey Mouseâ€™s and other big characters wondering round the park? Why just have one and make a big deal of this mere photo opportunity, put him in a big special building for this purpose and then make you wait all that time. Why so orchestrated?I thought I might see some tricks and fun things in the streets as I walked around but I didnâ€™t. I think sometimes people pay a lot for things and then become invested so they say things were good cause they donâ€™t wanna admit they wasted money on a bad idea or that the ideas they have for passing time are actually rubbish ðŸ˜‚Finally, I didnâ€™t see anything that was very entertaining for such young babies. Like a baby play area or anything like that. It may be a bit much to expect them to cater in this regard but, who are they catering to currently? I didnâ€™t feel like it was me, and it wasnâ€™t for the babyâ€¦ so just kids? Well it doesnâ€™t have to be that way. Put on more entertainment, shows, street tricks, activities",2.0,"The reviewer was disappointed with their visit to Disneyland in China. They found the entertainment to be insufficient, with long queues incompatible with the value delivered by the rides. They were expecting more of an electric vibe with street acts and found the focus mainly on rides that involved substantial waiting times. The reviewer also criticized the orchestrated photo opportunity with characters like Mickey Mouse which also involved a lengthy wait, suggesting that characters should roam around the park instead. They also mentioned a lack of facilities for very young children and suggested Disneyland should diversify its entertainment to cater beyond just kids."
"Rubbish customer service, brought the wrong size at closing time rushing for the last train at night. Went back next day to exchange and was told by a member of staff I had to buy the correct size then go to the refund desk to get a refund. After the queuing up got to told I can't refund it as I had got free gifts when I had originally purchased a lot of items the day before and to get a refund I would have to give them the gifts back. All I wanted was to change the item to correct size. Supervisor came out and started to raise her voice and told me to go find her colleague who told us we could do this. Bare in mind this place is huge. She then shoved the back of the receipt in my face and shouted at us ( we have 3 kids, in Disneyland) saying it's in Chinese and English in her broken English. I had to walk out really frustrated and angry. The lack of customer relations is ridiculous, they are definitely better Disney parks than this one. We weren't trying to con them, al I wanted was the correct size for my son. Avoid Avoid Avoid.",1.0,"The review is overall negative, expressing frustration with the customer service. The reviewer bought the wrong size item in a hurry and tried to exchange it the next day, but was told they would have to buy the correct size first and then get a refund. They also encountered issues with a free gift that came with the original purchase, which the store wanted back in order to process the refund. The reviewer found the staff to be unhelpful and rude, especially a supervisor who raised her voice and was difficult to understand. The reviewer also mentioned the size of the store as an issue, felt wronged, and warns future customers to avoid this Disneyland store."
"I was super thrilled to see the first time Disneyland. It is really huge  and have variety of attractions. However, waiting for one ride can take from 1-2 hours. All day i had only 6-7 rides, when i could have more than that. Food is also little pricey. However, I enjoyed walking around and to be spectator of wonderful fireworks.",4.0,"The reviewer expressed great excitement about their first visit to Disneyland, praising its sizable area and diverse attractions. However, they were disappointed by the long waiting times for rides (1-2 hours), which resulted in them only experiencing 6-7 attractions throughout the day. They also commented that food prices were high. Despite these issues, they enjoyed strolling around the park and watching the impressive fireworks display."
"overall the experience was good. lets start from the advantages, the staff member was polite, we had a lot of fun there. but it's not recommended with no fast pass, especially the ones who wanna play the popular rides like the Tron rollercoaster (we bought one), if you wanna get to play all rides or at least half of them, a fast pass could help a lot. the average queue time for a ride could take an hour or more. Since we went in Wednesday there's not a lot of people, but sure there might be MASSVE amount of people in the summer break or other holidays.",4.0,"The reviewer had a good overall experience. They praised the polite staff and enjoyed the fun atmosphere. However, they do not recommend visiting without a fast pass, especially for popular rides like the Tron rollercoaster. To enjoy all or at least half of the rides, a fast pass is advised. The average waiting time for rides can exceed an hour. The reviewer visited on a Wednesday when it was less crowded but expects it could be extremely busy during summer breaks or holidays."
We came here straight after Paris Disney which we rated highly. Sadly July is a no to visit this place. It was local school holidays and we went on a Monday. The heat and lack of shade and indoor eating areas did us in. The lines and entrance confusion was a bad start but then the absence of shade in 39 degree heat was a no go. We did two rides and had to leave when we lined up for 40 minutes just to get into a place to eat only to then have to search for a table - after looking for a table for 20 minutes we headed home.,2.0,"The reviewer had a disappointing experience visiting an unspecified location in July, during local school holidays. The place was extremely crowded and the entry process was confusing. There was a lack of indoor eating areas and shade, which made the visit uncomfortable in the 39-degree heat. Long queuing times, both for rides and restaurants, made the experience even worse and led to them leaving early."
"The walk to the entrance if by tour bus is half an hour. Once you get to the gate area, there's so many zigzag barriers that even on a not so busy day, you have to walk round and round on what otherwise would only be a few steps without the barriers.This is the first Disneyland I've been to where you're allowed to bring in food.Rides and queues inside are otherwise orderly.  I only saw 3 people spitting on the ground (I was expecting more).  A few people were smoking outside the designated smoking areas.We spent 2 days here.  This can actually be experienced in a day.",4.0,"The reviewer highlights that getting to the park's entrance can be a bit lengthy if traveling by tour bus, taking around half an hour. The park's entrance layout includes many zigzag barriers which add unnecessary distance, even on quieter days. They also mention that contrary to other Disneyland locations, you can bring in your own food. Rides and queues are organized and relatively clean, with only a few instances of inappropriate behavior like spitting and smoking observed. Despite spending 2 days, the reviewer believes that the park can be fully experienced within a single day."
A below average Disneyland experience despite excellent hardware. I had fast pass to save time but still felt like I was a semi-finished good in a conveyance belt. My feeling is that 50% of the staffs didnâ€™t make guests feel welcoming and 70% has no smile on their face.Personally I disliked most is smoking. Itâ€™s not uncommon to see people smoking in non-smoking areas and the staffs appeared that they didnâ€™t care. This is extremely disturbing for a non-smoker like myself,3.0,"The reviewer had an unsatisfying experience at Disneyland, despite using a fast pass to expedite queue times. They found the staff unwelcoming, with a majority not smiling or engaging positively with guests. The reviewer was also annoyed by the widespread smoking in non-smoking areas, which was not addressed by staff, creating an uncomfortable environment for them as a non-smoker."
"It was rainy, hot, and humid so I wouldn't recommend going in June. BUT the air conditioning was excellent once you got into buildings. The Zootopia area is incredible and so cute! I also loved the Jack Sparrow ride and stunt show. So amazing! This is a wonderful park. Loved it!",5.0,"The reviewer had a mixed experience due to rainy, hot and humid weather in June, however, they enjoyed the excellent air conditioning inside the buildings. Highlights included the ""incredible"" Zootopia area, the Jack Sparrow ride and stunt show, which they found amazing. Despite the weather, they considered the park wonderful and loved their visit."
Good  but was quite disappointed with the handling of the queues for the shows by the staff and the waiting period was terrible. People were cutting lies trying to go over you and the entertainment shows were hardly 15 minutes. I would give it an average and Please note that seating areas to rest yourself are very limited. During peak hours it's a really killer. Dining was average to but there was a really good pastry shop in mickeys downtown. There were too many characters as well.  Shopping was excellent bur crowd control could be managed better.,3.0,"The reviewer had a mixed experience. They were disappointed with the handling of queues for shows and the long waiting periods, expressing dissatisfaction with the short duration of entertainment shows. They noted that seating areas were limited especially during peak hours and found dining average. They enjoyed a good pastry shop in Mickey's downtown but felt there were too many characters. They appreciated the shopping experience but felt crowd control could have been better managed. Overall, they rated the experience as average."
"Get harassed by all the illegal toads right infront of the Disney entrance, inside Disney and upon exit to try sell you all toys, service,etc. Super irritating.The working Crew are a huge turn off during our entry and during the games. Most of the staffs mostly dont live up to Disney name. They are rude and unhelpful. If you speak foreign lauggage here then good luck to you..I keep seing people either fight, quarrel or police came to escort people out from the park. Disaster.... this will be my first and last to visit the Shanghai Disney. Will not recommend anyone here unless you just wanna come here for Instagram than to enjoy a real theme park ride.",1.0,"The reviewer had a negative experience at Shanghai Disney due to aggressive vendors outside and inside the entrance. They were disappointed with the staff, who they found to be rude and unhelpful, especially towards those speaking foreign languages. They also noted frequent disturbances, such as fights and police interventions. They would not recommend visiting Shanghai Disney unless it was merely for Instagram photos and not for an enjoyable theme park experience. This was their first and will be their last visit to the park."
review,rating,summary
"Recommended weekday break to play queuing for about each project we are 30-40 minutes, some even only need 20 minutes or so, can save a lot of time to improve the cost-effective play more projects Oh ‼ in the bustling Shanghai, there is a piece of fantasy and reality intertwined with the magic of the place - Shanghai Disneyland. Here is a realistic interpretation of countless fairy tales, is the home of every childhood dream.",5.0,"The review recommends visiting Shanghai Disneyland on a weekday as the queues for attractions are typically 20-40 minutes, saving time and allowing you to experience more. The reviewer appreciates Shanghai Disneyland for being a place where fantasy and reality meet, reflecting various fairy tales and fulfilling childhood dreams. They believe it to be a magical and cost-effective place to visit."
"Hello everyone! I recently had the chance to visit Shanghai Disneyland on October 17, 2024. I arrived at the park at 10:30 a.m. and stayed until the fireworks ended. I spent the day capturing photos, watching shows, and enjoying the rides. Follow along for the details!PreparationBefore heading to the park, I downloaded the Shanghai Disney Resort app, which offers options to purchase tickets, Early Park Entry Pass, Disney Premier Access, Disney PhotoPass One Day Pass, and Personalized Magical Photo Session, with payments accepted via Alipay, WeChat Pay, and international cards.I discovered the Personalized Magical Photo Session on the app, which appealed to me as a photography enthusiast. I wanted beautiful photos to post on social media, so I booked a session (bookings must be made at least one day in advance). The cost was ¥700, but due to issues with my travel card, I had to pay via Alipay with a 3% surcharge, totaling ¥721. The private photographer follows you for 90 minutes, with a maximum of six people per session.In addition to this, there’s also the Disney PhotoPass One Day Pass for ¥288, which allows you to take photos with designated photographers around the park and download ride photos.I also checked the show schedule and selected which ones I wanted to see, as showtimes are fixed. I chose Mickey’s Storybook Adventure, Golden Fairytale Fanfare, Mickey’s Storybook Express, and ILLUMINATE! A Nighttime Celebration.Then I looked through the menu for dining options and chose Mickey & Pals Market Café, Barbossa’s Bounty, and Zootopia Market.Finally, I checked the wait times for rides on the app to decide if purchasing Disney Premier Access would be worthwhile.The VisitI arrived at the parking lot and walked about 20 minutes to the park entrance. There’s a Mickey fountain at the entrance. Security checks are similar to other Disney parks; selfie sticks and tripods are prohibited and must be left in lockers, while food and drinks are generally allowed.Entering the park is unique here—you scan your passport, which also serves as your park ticket. You’ll receive a paper ticket with a QR code for reservations, like the Standby Pass for Mickey’s Storybook Adventure. I reserved the 11:40 a.m. show.After entering, I visited Carefree Corner to confirm my Personalized Magical Photo Session, choosing the 4:00 p.m. slot. I then stopped by Avenue M Arcade to buy some Mickey ears for photos and queued up for Mickey’s Storybook Adventure at 10:40 a.m.ShowsMickey’s Storybook AdventureThis indoor show takes you through Disney stories with 23 characters. Mickey and Goofy discover a magic book, encountering Olaf, Baloo, King Louie, Moana, Mulan, and others along the way, with live music mainly in Chinese and some English songs.Golden Fairytale FanfareAn outdoor show in front of the Enchanted Storybook Castle featuring Snow White, Elsa, Anna, Jasmine, Aladdin, Ariel, Merida, and more, with English songs.Mickey’s Storybook ExpressA 14-minute character parade with numerous Disney favorites.ILLUMINATE! A Nighttime CelebrationA projection mapping show at the Enchanted Storybook Castle with fireworks, fountains, lasers, and Disney and Marvel characters.DiningMickey & Pals Market Café•	Ma La Tang Noodle Soup with Prawn and Beef (¥119) + Dumplings (¥30) - Spicy, tongue-tingling soup with beef slices and shrimp.•	Roasted Spring Chicken with Vegetables (¥129) - Sweet, roasted chicken with a tomato-edamame side.Barbossa’s Bounty•	Barbossa Feast for 2 (¥299) - Grilled squid, ribs, and chicken with two servings of rice; overall, it has a sweet flavor.Zootopia Market•	Disney Zootopia Pawpsicle (¥45) - A sweet and tangy fruit popsicle, perfect for a warm day.RidesPirates of the Caribbean Battle for the Sunken TreasureA boat ride through scenes from Pirates of the Caribbean, with forward, backward, and rotating movements. The visuals and sound effects are impressive, and there’s a small wave toward the end, but it’s not intense.Seven Dwarfs Mine TrainThis ride has a single rider lane, but wait times are similar to the main queue (~1 hour). I bought Disney Premier Access for ¥180, which saved a lot of time. The train takes you through the dwarves’ mine, providing mild thrills.Soaring Over the HorizonSimilar to Disney World and DisneySea, this flight simulation ride takes you over global landmarks with scents like grass and ocean waves for an immersive experience.TRON Lightcycle Power RunExperience riding a TRON motorcycle. You lean forward on the bike and hold onto handlebars, speeding along a thrilling track that’s still accessible for younger guests.Zootopia: Hot PursuitA trackless ride where you pursue runaway sheep from Zootopia. It’s fun, and the single rider line is very short, so I didn’t need to wait.Photo SessionAfter the parade at 3:30 p.m., I headed to Carefree Corner for my photo session. The photographer spoke Chinese, so I used Google Translate to communicate. I requested locations like Gardens of Imagination, Castle Area, Castle Balcony, and Zootopia, and we took photos throughout. With 30 minutes left, I requested to visit Treasure Cove. We wrapped up the session with 100 photos, which were available for download that evening. Note: photos must be downloaded within 90 days, or they’re deleted automatically.Overall, my day at Shanghai Disneyland was filled with memorable shows, tasty food, thrilling rides, and unique photo ops.",5.0,"The user visited Shanghai Disneyland and had a highly detailed and immersive experience. Prior to the visit, they downloaded the Shanghai Disney Resort app for various convenience features and booked a Personalized Magical Photo Session. The park entry system is unique, requiring a passport scan. Four different shows were attended, namely Mickey’s Storybook Adventure, Golden Fairytale Fanfare, Mickey’s Storybook Express, and ILLUMINATE! A Nighttime Celebration. They had meals at Mickey & Pals Market Café, Barbossa’s Bounty, and Zootopia Market. The rides they enjoyed include Pirates of the Caribbean Battle for the Sunken Treasure, Seven Dwarfs Mine Train, Soaring Over the Horizon, TRON Lightcycle Power Run, and Z"
"We have been to almost all Disneyland around the world and we can say that this is the only one which we enjoyed the most. We went there in mid October and it was amazing. The weather was good and it's not crowded at all during non-peak season. Disneyland Tokyo on the other hand is busy all year round.The park is clean and very well-maintained. Food and the souvenirs are so much cheaper as compared to the rest of the Disneyland. We were spoilt for choices with the wide selection of restaurants and cafes in Disneyland Village. The staff are friendly and most importantly, it's very safe. We can just leave our strollers at ease in the park.The park itself is of a great size and most of the rides are suitable for preschoolers. My daughter is 3 years old (less than 100cm) and there are still quite a few rides she can enjoy. On the other hand, my son who is 5 (110cm), can enjoy most of the rides. He was unable to access a few due to height restrictions.One day pass to Disneyland with DPA is doable during NON-PEAK season but I will still advise a two day pass for a more enjoyable experience.  We checked into the Toy Story Hotel the day before, which is of close proximity to the park so we can start the next day fresh at Disneyland. Staying at Toy Story Hotel or Disneyland Hotel has it's perks as their customers are able to access the park an hour earlier (7.30am) prior the opening hour (8.30am) but we did not utilise it at all. Just for your information, tickets prices from the hotels are the same as those we purchased from Disneyland app. We entered the park at around 11am on the first day and we were still able to complete the DPA (Disney Primer Access) x 11 rides on the first day. For the second day, we just targeted on those rides which we miss out on day one.Most of the rides only took about 15 - 20 minutes without the DPA access, with some of no queue at all. Only a few of the popular rides took about 45 - 60 minutes. We bought the DPA Deluxe Set of 11 before our trip. With this DPA set, we had a special entrance which led us right in front of the castle for the night illumination show, which we enjoyed a lot. It is a must watch at every Disneyland especially in Shanghai. In addition, I will also recommend Zootopia land as is one of our favourites! Overall, this is one of the best Disneyland experience we had. Highly recommended for everyone. :)",5.0,"The reviewer highly recommends this Disneyland location, describing it as the best one they have visited worldwide. They enjoyed the lack of crowds in mid-October and the cleanliness and maintenance of the park. The reviewer appreciated the value of the food and souvenirs and the diverse selection at various cafes and restaurants. They also noted the friendly staff and felt safe leaving their belongings around the park. They were pleased that the park's rides were suitable for their young children, although noted some height restrictions. The Toy Story Hotel, closely located to Disneyland was a convenient place to stay, offering early access benefits. The reviewer suggests purchasing a two-day pass for a more enjoyable, paced experience and purchasing the Disney Primer Access for a delightful night illumination show. They also recommended Z"
